{
  "source": {
    "name": "USDA FSIS FoodKeeper data (English JSON)",
    "url": "https://www.foodsafety.gov/sites/default/files/foodkeeper_data_url_en.json",
    "retrieved_via": "https://web.archive.org/web/20260416174248id_/https://www.foodsafety.gov/sites/default/files/foodkeeper_data_url_en.json (direct fsis.usda.gov/foodsafety.gov downloads returned HTTP 403 from our network)",
    "catalog": "https://catalog.data.gov/dataset/fsis-foodkeeper-data",
    "license": "CC0 1.0 (per data.gov)",
    "method": "For each category, cited FoodKeeper products; each range reduced to its shorter end; category value = minimum across cited products. Weeks x7, months x30, years x365. Non-numeric values ('When Ripe', 'Package use-by date', 'Not Recommended', 'Indefinitely') are never converted; they yield null."
  },
  "categories": [
    {
      "category": "leafy greens",
      "fridge_days": 3,
      "pantry_days": null,
      "freezer_days": null,
      "default_storage": "fridge",
      "foodkeeper_product_ids": [
        "291",
        "415"
      ],
      "source_note": "USDA FoodKeeper (foodsafety.gov JSON). Conversion: 1 week=7d, 1 month=30d, 1 year=365d. fridge_days=3 (min of shorter range ends): #415 \"Bagged greens (leaf, spinach, lettuce, etc.)\" refrigerate=\"3 - 5 Days\"->3d; #291 \"Lettuce (leaf, spinach)\" refrigerate from purchase=\"3 - 7 Days\"->3d | pantry_days null: No FoodKeeper pantry entry for leafy greens. | freezer_days null: FoodKeeper lists freezing as 'Not Recommended' for #415 and #291.",
      "app_category_key": "leafy_greens"
    },
    {
      "category": "berries",
      "fridge_days": 2,
      "pantry_days": null,
      "freezer_days": 240,
      "default_storage": "fridge",
      "foodkeeper_product_ids": [
        "253",
        "254",
        "481",
        "482"
      ],
      "source_note": "USDA FoodKeeper (foodsafety.gov JSON). Conversion: 1 week=7d, 1 month=30d, 1 year=365d. fridge_days=2 (min of shorter range ends): #481 \"Strawberries\" refrigerate from purchase=\"2 - 3 Days\"->2d; #482 \"Raspberries\" refrigerate from purchase=\"2 - 3 Days\"->2d; #253 \"Berries (blackberries, boysenberries, currant)\" refrigerate from purchase=\"3 - 6 Days\"->3d; #254 \"Blueberries\" refrigerate from purchase=\"1 - 2 Weeks\"->7d | pantry_days null: No FoodKeeper pantry entry for berries. | freezer_days=240 (min of shorter range ends): #481 \"Strawberries\" freeze=\"8 - 12 Months\"->240d; #482 \"Raspberries\" freeze=\"8 - 12 Months\"->240d; #254 \"Blueberries\" freeze=\"8 - 12 Months\"->240d; #253 \"Berries (blackberries, boysenberries, currant)\" freeze=\"12 Months\"->360d",
      "app_category_key": "berries"
    },
    {
      "category": "other fresh fruit",
      "fridge_days": 3,
      "pantry_days": 1,
      "freezer_days": 30,
      "default_storage": "fridge",
      "foodkeeper_product_ids": [
        "248",
        "250",
        "251",
        "256",
        "261",
        "266"
      ],
      "source_note": "USDA FoodKeeper (foodsafety.gov JSON). Conversion: 1 week=7d, 1 month=30d, 1 year=365d. fridge_days=3 (min of shorter range ends): #248 \"Apples\" refrigerate from purchase=\"4 - 6 Weeks\"->28d; #251 \"Bananas\" refrigerate=\"3 Days\"->3d; #256 \"Citrus fruit (lemon, lime, orange, grapefruit, tangerines, clementines)\" refrigerate from purchase=\"10 - 21 Days\"->10d; #261 \"Grapes\" refrigerate from purchase=\"1 Week\"->7d; #266 \"Peaches, nectarines, plums, pears, sapote\" refrigerate=\"3 - 5 Days\"->3d; #250 \"Avocados\" refrigerate=\"3 - 4 Days\"->3d | pantry_days=1 (min of shorter range ends): #248 \"Apples\" pantry from purchase=\"3 Weeks\"->21d; #256 \"Citrus fruit (lemon, lime, orange, grapefruit, tangerines, clementines)\" pantry from purchase=\"10 Days\"->10d; #261 \"Grapes\" pantry from purchase=\"1 Day\"->1d | freezer_days=30 (min of shorter range ends): #248 \"Apples\" freeze=\"8 Months\"->240d; #251 \"Bananas\" freeze=\"2 - 3 Months\"->60d; #261 \"Grapes\" freeze=\"1 Month\"->30d; #266 \"Peaches, nectarines, plums, pears, sapote\" freeze=\"2 Months\"->60d | Bananas/avocados/stone fruit list pantry as 'When Ripe' (non-numeric) and are excluded from pantry_days. Citrus and avocado freezing is 'Not Recommended'. Category value is the most conservative cited product; apples/citrus actually last much longer (apples Rp 4-6 Weeks).",
      "app_category_key": "fresh_fruit"
    },
    {
      "category": "root vegetables",
      "fridge_days": 7,
      "pantry_days": 14,
      "freezer_days": 180,
      "default_storage": "fridge",
      "foodkeeper_product_ids": [
        "274",
        "279",
        "294",
        "297",
        "299",
        "307",
        "422"
      ],
      "source_note": "USDA FoodKeeper (foodsafety.gov JSON). Conversion: 1 week=7d, 1 month=30d, 1 year=365d. fridge_days=7 (min of shorter range ends): #279 \"Carrots, parsnips\" refrigerate from purchase=\"2 - 3 Weeks\"->14d; #274 \"Beets\" refrigerate from purchase=\"1 - 2 Weeks\"->7d; #297 \"Potatoes\" refrigerate from purchase=\"1 - 2 Weeks\"->7d; #294 \"Onions (yellow, white, red, etc.)\" refrigerate from purchase=\"2 Months\"->60d; #307 \"Turnips\" refrigerate from purchase=\"2 Weeks\"->14d; #299 \"Radishes\" refrigerate from purchase=\"10 - 14 Days\"->10d | pantry_days=14 (min of shorter range ends): #297 \"Potatoes\" pantry from purchase=\"1 - 2 Months\"->30d; #294 \"Onions (yellow, white, red, etc.)\" pantry from purchase=\"1 Month\"->30d; #422 \"Yams/sweet potatoes\" pantry from purchase=\"2 - 3 Weeks\"->14d | freezer_days=180 (min of shorter range ends): #279 \"Carrots, parsnips\" freeze from purchase=\"10 - 12 Months\"->300d; #274 \"Beets\" freeze from purchase=\"6 - 8 Months\"->180d; #297 \"Potatoes\" freeze=\"10 - 12 Months\"->300d; #294 \"Onions (yellow, white, red, etc.)\" freeze from purchase=\"10 - 12 Months\"->300d | pantry_days applies only to potatoes/onions/sweet potatoes; carrots, beets (Pp 1 Day) and radishes should be refrigerated. Radishes freezing 'Not Recommended'.",
      "app_category_key": "root_vegetables"
    },
    {
      "category": "other fresh vegetables",
      "fridge_days": 3,
      "pantry_days": null,
      "freezer_days": 150,
      "default_storage": "fridge",
      "foodkeeper_product_ids": [
        "271",
        "276",
        "280",
        "281",
        "283",
        "292",
        "296",
        "302",
        "600"
      ],
      "source_note": "USDA FoodKeeper (foodsafety.gov JSON). Conversion: 1 week=7d, 1 month=30d, 1 year=365d. fridge_days=3 (min of shorter range ends): #276 \"Broccoli and broccoli raab (rapini)\" refrigerate from purchase=\"3 - 5 Days\"->3d; #280 \"Cauliflower\" refrigerate from purchase=\"3 - 5 Days\"->3d; #296 \"Peppers\" refrigerate from purchase=\"4 - 14 Days\"->4d; #283 \"Cucumbers\" refrigerate from purchase=\"4 - 6 Days\"->4d; #302 \"Squash (summer and zucchini)\" refrigerate from purchase=\"4 - 5 Days\"->4d; #292 \"Mushrooms\" refrigerate from purchase=\"3 - 7 Days\"->3d; #271 \"Asparagus\" refrigerate from purchase=\"3 - 4 Days\"->3d; #281 \"Celery\" refrigerate from purchase=\"1 - 2 Weeks\"->7d; #600 \"Cherry tomatoes\" refrigerate=\"5 Days\"->5d | pantry_days null: No single numeric pantry value: whole tomatoes are 'When Ripe' (#306); cherry tomatoes P=10 Days (#600); most others have no pantry entry. Left null. | freezer_days=150 (min of shorter range ends): #276 \"Broccoli and broccoli raab (rapini)\" freeze from purchase=\"10 - 12 Months\"->300d; #296 \"Peppers\" freeze from purchase=\"6 - 8 Months\"->180d; #271 \"Asparagus\" freeze from purchase=\"5 Months\"->150d; #292 \"Mushrooms\" freeze from purchase=\"10 - 12 Months\"->300d; #302 \"Squash (summer and zucchini)\" freeze from purchase=\"10 - 12 Months\"->300d | Cucumbers freezing 'Not Recommended' (#283).",
      "app_category_key": "fresh_vegetables"
    },
    {
      "category": "fresh herbs",
      "fridge_days": 7,
      "pantry_days": null,
      "freezer_days": 30,
      "default_storage": "fridge",
      "foodkeeper_product_ids": [
        "288"
      ],
      "source_note": "USDA FoodKeeper (foodsafety.gov JSON). Conversion: 1 week=7d, 1 month=30d, 1 year=365d. fridge_days=7 (min of shorter range ends): #288 \"Herbs\" refrigerate from purchase=\"7 - 10 Days\"->7d | pantry_days null: Generic 'Herbs' (#288) has no pantry entry (fresh basil #509 lists P=5 Days, but not generalized). | freezer_days=30 (min of shorter range ends): #288 \"Herbs\" freeze from purchase=\"1 - 2 Months\"->30d | Uses generic FoodKeeper 'Herbs' product. Item-level FoodKeeper values vary: parsley #611 R=2-3 Days, basil #509 R=10 Days, cilantro #506 R=2-3 Weeks.",
      "app_category_key": "herbs"
    },
    {
      "category": "raw poultry",
      "fridge_days": 1,
      "pantry_days": null,
      "freezer_days": 270,
      "default_storage": "fridge",
      "foodkeeper_product_ids": [
        "113",
        "114",
        "116",
        "117",
        "118"
      ],
      "source_note": "USDA FoodKeeper (foodsafety.gov JSON). Conversion: 1 week=7d, 1 month=30d, 1 year=365d. fridge_days=1 (min of shorter range ends): #113 \"Chicken (whole)\" refrigerate from purchase=\"1 - 2 Days\"->1d; #116 \"Chicken parts (breast halves, bone-in)\" refrigerate from purchase=\"1 - 2 Days\"->1d; #117 \"Chicken parts (breast halves, boneless)\" refrigerate from purchase=\"1 - 2 Days\"->1d; #118 \"Chicken parts (legs or thighs)\" refrigerate from purchase=\"1 - 2 Days\"->1d; #114 \"Turkey (whole)\" refrigerate from purchase=\"1 - 2 Days\"->1d | pantry_days null: Not applicable (perishable raw meat). | freezer_days=270 (min of shorter range ends): #113 \"Chicken (whole)\" freeze from purchase=\"12 Months\"->360d; #116 \"Chicken parts (breast halves, bone-in)\" freeze from purchase=\"9 Months\"->270d; #117 \"Chicken parts (breast halves, boneless)\" freeze from purchase=\"9 Months\"->270d; #118 \"Chicken parts (legs or thighs)\" freeze from purchase=\"9 Months\"->270d",